{
  "eventId": "019b0000-0000-7000-8000-000000000012",
  "eventType": "agent-run.capacity-wait.v1",
  "schemaVersion": 1,
  "occurredAt": "2026-07-22T16:00:00Z",
  "producer": "scheduler",
  "tenantId": "019b0000-0000-7000-8000-000000000002",
  "projectId": "019b0000-0000-7000-8000-000000000003",
  "runId": "019b0000-0000-7000-8000-000000000004",
  "aggregateType": "AgentRun",
  "aggregateId": "019b0000-0000-7000-8000-000000000004",
  "aggregateVersion": 3,
  "correlationId": "run-example",
  "causationId": "claim-example",
  "payload": {
    "projectId": "019b0000-0000-7000-8000-000000000003",
    "runId": "019b0000-0000-7000-8000-000000000004",
    "status": "CAPACITY_WAIT",
    "attemptNumber": 1,
    "reasonCode": "NO_CAPACITY",
    "reason": "no eligible cluster has sufficient capacity",
    "nextEligibleAt": "2026-07-22T16:00:30Z"
  }
}